{
  "schema_version": "aud-calibration-baseline-v1",
  "baseline_id": "BASELINE-RELSUM-69F9F6B62C66413706C4",
  "suite_id": "CALSUITE-AUD-V2-CANONICAL",
  "suite_version": "1.0.0",
  "accepted_at": "2026-09-04T00:00:00Z",
  "rationale": "Initial Phase 6 baseline finalized after explicit review of all report-only and authority-boundary expectations.",
  "evaluator": { "name": "aud-calibration", "version": "1.0.0", "source_revision": "e0d7f5f17e322c3b4519a8c5d9505e9526775743" },
  "threshold_hash": "a039cfd66242f3ee3c15170a5f660bf1910978d1631187e3736e762a7f696ad0",
  "expectations_hash": "ba07379e17eb09c16b02f9bca1a6fa7714c39f945d35a22b5e04269a172f78de",
  "cases": [
    { "case_id": "CALCASE-01-MAJOR", "case_version": "1.0.0", "input_revision": "aaaaaaaaaaaaaaaaaaaaaaaaaaaaaaaaaaaaaaaa" },
    { "case_id": "CALCASE-02-MINOR", "case_version": "1.0.0", "input_revision": "aaaaaaaaaaaaaaaaaaaaaaaaaaaaaaaaaaaaaaaa" },
    { "case_id": "CALCASE-03-COSMETIC", "case_version": "1.0.0", "input_revision": "aaaaaaaaaaaaaaaaaaaaaaaaaaaaaaaaaaaaaaaa" },
    { "case_id": "CALCASE-04-NONISSUE", "case_version": "1.0.0", "input_revision": "aaaaaaaaaaaaaaaaaaaaaaaaaaaaaaaaaaaaaaaa" },
    { "case_id": "CALCASE-05-AMBIGUOUS", "case_version": "1.0.0", "input_revision": "aaaaaaaaaaaaaaaaaaaaaaaaaaaaaaaaaaaaaaaa" },
    { "case_id": "CALCASE-06-INSUFFICIENT", "case_version": "1.0.0", "input_revision": "aaaaaaaaaaaaaaaaaaaaaaaaaaaaaaaaaaaaaaaa" },
    { "case_id": "CALCASE-07-DUPLICATE", "case_version": "1.0.0", "input_revision": "aaaaaaaaaaaaaaaaaaaaaaaaaaaaaaaaaaaaaaaa" },
    { "case_id": "CALCASE-08-REINFORCING", "case_version": "1.0.0", "input_revision": "aaaaaaaaaaaaaaaaaaaaaaaaaaaaaaaaaaaaaaaa" },
    { "case_id": "CALCASE-09-CONTRADICTION", "case_version": "1.0.0", "input_revision": "aaaaaaaaaaaaaaaaaaaaaaaaaaaaaaaaaaaaaaaa" },
    { "case_id": "CALCASE-10-ROOT-CAUSE", "case_version": "1.0.0", "input_revision": "aaaaaaaaaaaaaaaaaaaaaaaaaaaaaaaaaaaaaaaa" },
    { "case_id": "CALCASE-11-UNRELATED", "case_version": "1.0.0", "input_revision": "aaaaaaaaaaaaaaaaaaaaaaaaaaaaaaaaaaaaaaaa" },
    { "case_id": "CALCASE-12-BLOCKING", "case_version": "1.0.0", "input_revision": "aaaaaaaaaaaaaaaaaaaaaaaaaaaaaaaaaaaaaaaa" },
    { "case_id": "CALCASE-13-ORDER", "case_version": "1.0.0", "input_revision": "aaaaaaaaaaaaaaaaaaaaaaaaaaaaaaaaaaaaaaaa" },
    { "case_id": "CALCASE-14-PARTIAL", "case_version": "1.0.0", "input_revision": "aaaaaaaaaaaaaaaaaaaaaaaaaaaaaaaaaaaaaaaa" },
    { "case_id": "CALCASE-15-FAILED", "case_version": "1.0.0", "input_revision": "aaaaaaaaaaaaaaaaaaaaaaaaaaaaaaaaaaaaaaaa" },
    { "case_id": "CALCASE-16-REGRESSION", "case_version": "1.0.0", "input_revision": "aaaaaaaaaaaaaaaaaaaaaaaaaaaaaaaaaaaaaaaa" },
    { "case_id": "CALCASE-17-RESOLVED", "case_version": "1.0.0", "input_revision": "aaaaaaaaaaaaaaaaaaaaaaaaaaaaaaaaaaaaaaaa" },
    { "case_id": "CALCASE-18-STALE", "case_version": "1.0.0", "input_revision": "aaaaaaaaaaaaaaaaaaaaaaaaaaaaaaaaaaaaaaaa" },
    { "case_id": "CALCASE-19-INCOMPATIBLE", "case_version": "1.0.0", "input_revision": "aaaaaaaaaaaaaaaaaaaaaaaaaaaaaaaaaaaaaaaa" },
    { "case_id": "CALCASE-20-DEGRADED", "case_version": "1.0.0", "input_revision": "aaaaaaaaaaaaaaaaaaaaaaaaaaaaaaaaaaaaaaaa" }
  ],
  "case_ids": [
    "CALCASE-01-MAJOR", "CALCASE-02-MINOR", "CALCASE-03-COSMETIC", "CALCASE-04-NONISSUE", "CALCASE-05-AMBIGUOUS",
    "CALCASE-06-INSUFFICIENT", "CALCASE-07-DUPLICATE", "CALCASE-08-REINFORCING", "CALCASE-09-CONTRADICTION", "CALCASE-10-ROOT-CAUSE",
    "CALCASE-11-UNRELATED", "CALCASE-12-BLOCKING", "CALCASE-13-ORDER", "CALCASE-14-PARTIAL", "CALCASE-15-FAILED",
    "CALCASE-16-REGRESSION", "CALCASE-17-RESOLVED", "CALCASE-18-STALE", "CALCASE-19-INCOMPATIBLE", "CALCASE-20-DEGRADED"
  ],
  "metrics": [
    { "name": "finding_precision", "status": "measured", "value": 1 },
    { "name": "finding_recall", "status": "measured", "value": 1 },
    { "name": "false_positive_rate", "status": "measured", "value": 0 },
    { "name": "false_negative_rate", "status": "measured", "value": 0 },
    { "name": "severity_agreement", "status": "measured", "value": 1 },
    { "name": "confidence_calibration", "status": "measured", "value": 0.7688 },
    { "name": "duplicate_clustering_precision", "status": "measured", "value": 1 },
    { "name": "duplicate_clustering_recall", "status": "measured", "value": 1 },
    { "name": "contradiction_detection_accuracy", "status": "measured", "value": 1 },
    { "name": "relationship_accuracy", "status": "measured", "value": 1 },
    { "name": "root_cause_accuracy", "status": "measured", "value": 1 },
    { "name": "priority_agreement", "status": "measured", "value": 1 },
    { "name": "remediation_order_validity", "status": "measured", "value": 1 },
    { "name": "verification_outcome_accuracy", "status": "measured", "value": 1 },
    { "name": "regression_detection_accuracy", "status": "measured", "value": 1 },
    { "name": "lifecycle_transition_legality", "status": "measured", "value": 1 },
    { "name": "deterministic_rerun_agreement", "status": "measured", "value": 1 },
    { "name": "schema_validity", "status": "measured", "value": 1 },
    { "name": "provenance_completeness", "status": "measured", "value": 1 },
    { "name": "critical_false_negatives", "status": "measured", "value": 0 },
    { "name": "mutation_violations", "status": "measured", "value": 0 },
    { "name": "unstable_stable_ids", "status": "measured", "value": 0 },
    { "name": "verified_without_evidence", "status": "measured", "value": 0 },
    { "name": "fabricated_results", "status": "measured", "value": 0 }
  ]
}
